trt-samples-for-hackathon-cn/cookbook/07-Tool/trtexec/result-02.log
[01/02/2024-22:52:54] [V] [TRT] *************** Autotuning Reformat: Float(784,784,28,1) -> Float(784,1,28,1) ***************
[01/02/2024-22:52:54] [V] [TRT] --------------- Timing Runner: Optimizer Reformat(tensorX -> <out>) (Reformat)
[01/02/2024-22:52:54] [V] [TRT] Tactic: 0x00000000000003e8 Time: 0.00283115
[01/02/2024-22:52:54] [V] [TRT] Tactic: 0x00000000000003ea Time: 0.00470002
[01/02/2024-22:52:54] [V] [TRT] Tactic: 0x0000000000000000 Time: 0.00280238
[01/02/2024-22:52:54] [V] [TRT] Fastest Tactic: 0x0000000000000000 Time: 0.00280238
[01/02/2024-22:52:54] [V] [TRT] *************** Autotuning Reformat: Float(784,784,28,1) -> Float(784,1:4,28,1) ***************
[01/02/2024-22:52:54] [V] [TRT] --------------- Timing Runner: Optimizer Reformat(tensorX -> <out>) (Reformat)
[01/02/2024-22:52:54] [V] [TRT] Tactic: 0x00000000000003e8 Time: 0.00525061
[01/02/2024-22:52:54] [V] [TRT] Tactic: 0x00000000000003ea Time: 0.00634196
[01/02/2024-22:52:54] [V] [TRT] Tactic: 0x0000000000000000 Time: 0.00514612
[01/02/2024-22:52:54] [V] [TRT] Fastest Tactic: 0x0000000000000000 Time: 0.00514612
[01/02/2024-22:52:54] [V] [TRT] *************** Autotuning Reformat: Float(784,784,28,1) -> Half(784,784,28,1) ***************
[01/02/2024-22:52:54] [V] [TRT] --------------- Timing Runner: Optimizer Reformat(tensorX -> <out>) (Reformat)
[01/02/2024-22:52:54] [V] [TRT] Tactic: 0x00000000000003e8 Time: 0.00195989
[01/02/2024-22:52:54] [V] [TRT] Tactic: 0x00000000000003ea Time: 0.00467171
[01/02/2024-22:52:54] [V] [TRT] Tactic: 0x0000000000000000 Time: 0.00413779
[01/02/2024-22:52:54] [V] [TRT] Fastest Tactic: 0x00000000000003e8 Time: 0.00195989
[01/02/2024-22:52:54] [V] [TRT] *************** Autotuning Reformat: Float(784,784,28,1) -> Half(784,784:2,28,1) ***************
[01/02/2024-22:52:54] [V] [TRT] --------------- Timing Runner: Optimizer Reformat(tensorX -> <out>) (Reformat)
[01/02/2024-22:52:54] [V] [TRT] Tactic: 0x00000000000003e8 Time: 0.00325486
[01/02/2024-22:52:54] [V] [TRT] Tactic: 0x00000000000003ea Time: 0.00858783
[01/02/2024-22:52:54] [V] [TRT] Tactic: 0x0000000000000000 Time: 0.00259857
[01/02/2024-22:52:54] [V] [TRT] Fastest Tactic: 0x0000000000000000 Time: 0.00259857
[01/02/2024-22:52:54] [V] [TRT] =============== Computing reformatting costs: 
[01/02/2024-22:52:54] [V] [TRT] *************** Autotuning Reformat: Float(25088,784,28,1) -> Float(6272,1:4,224,8) ***************
[01/02/2024-22:52:54] [V] [TRT] --------------- Timing Runner: Optimizer Reformat(A-V-1-Relu -> <out>) (Reformat)
[01/02/2024-22:52:54] [V] [TRT] Tactic: 0x00000000000003e8 Time: 0.0301056
[01/02/2024-22:52:54] [V] [TRT] Tactic: 0x00000000000003ea Time: 0.0665615
[01/02/2024-22:52:54] [V] [TRT] Tactic: 0x0000000000000000 Time: 0.0301641
[01/02/2024-22:52:54] [V] [TRT] Fastest Tactic: 0x00000000000003e8 Time: 0.0301056
[01/02/2024-22:52:54] [V] [TRT] *************** Autotuning Reformat: Float(25088,784,28,1) -> Half(25088,784,28,1) ***************
[01/02/2024-22:52:54] [V] [TRT] --------------- Timing Runner: Optimizer Reformat(A-V-1-Relu -> <out>) (Reformat)
[01/02/2024-22:52:54] [V] [TRT] Tactic: 0x00000000000003e8 Time: 0.0129825
[01/02/2024-22:52:54] [V] [TRT] Tactic: 0x00000000000003ea Time: 0.0241615
[01/02/2024-22:52:54] [V] [TRT] Tactic: 0x0000000000000000 Time: 0.0256731
[01/02/2024-22:52:54] [V] [TRT] Fastest Tactic: 0x00000000000003e8 Time: 0.0129825
[01/02/2024-22:52:54] [V] [TRT] *************** Autotuning Reformat: Float(25088,784,28,1) -> Half(12544,784:2,28,1) ***************
[01/02/2024-22:52:54] [V] [TRT] --------------- Timing Runner: Optimizer Reformat(A-V-1-Relu -> <out>) (Reformat)
[01/02/2024-22:52:54] [V] [TRT] Tactic: 0x00000000000003e8 Time: 0.0253806
[01/02/2024-22:52:54] [V] [TRT] Tactic: 0x00000000000003ea Time: 0.0322999
[01/02/2024-22:52:54] [V] [TRT] Tactic: 0x0000000000000000 Time: 0.0147163
[01/02/2024-22:52:54] [V] [TRT] Fastest Tactic: 0x0000000000000000 Time: 0.0147163
[01/02/2024-22:52:54] [V] [TRT] *************** Autotuning Reformat: Float(25088,1,896,32) -> Float(25088,784,28,1) ***************
[01/02/2024-22:52:54] [V] [TRT] --------------- Timing Runner: Optimizer Reformat(A-V-1-Relu -> <out>) (Reformat)
[01/02/2024-22:52:54] [V] [TRT] Tactic: 0x00000000000003e8 Time: 0.0253059
[01/02/2024-22:52:54] [V] [TRT] Tactic: 0x00000000000003ea Time: 0.0606598
[01/02/2024-22:52:54] [V] [TRT] Tactic: 0x0000000000000000 Time: 0.0248457
[01/02/2024-22:52:54] [V] [TRT] Fastest Tactic: 0x0000000000000000 Time: 0.0248457
[01/02/2024-22:52:54] [V] [TRT] *************** Autotuning Reformat: Float(25088,1,896,32) -> Float(6272,1:4,224,8) ***************
[01/02/2024-22:52:54] [V] [TRT] --------------- Timing Runner: Optimizer Reformat(A-V-1-Relu -> <out>) (Reformat)
[01/02/2024-22:52:54] [V] [TRT] Tactic: 0x00000000000003e8 Time: 0.0270629
[01/02/2024-22:52:54] [V] [TRT] Tactic: 0x00000000000003ea Time: 0.0567589
[01/02/2024-22:52:54] [V] [TRT] Tactic: 0x0000000000000000 Time: 0.0267215
[01/02/2024-22:52:54] [V] [TRT] Fastest Tactic: 0x0000000000000000 Time: 0.0267215
[01/02/2024-22:52:54] [V] [TRT] *************** Autotuning Reformat: Float(25088,1,896,32) -> Half(25088,784,28,1) ***************
[01/02/2024-22:52:54] [V] [TRT] --------------- Timing Runner: Optimizer Reformat(A-V-1-Relu -> <out>) (Reformat)
[01/02/2024-22:52:54] [V] [TRT] Tactic: 0x00000000000003e8 Time: 0.0233221
[01/02/2024-22:52:54] [V] [TRT] Tactic: 0x00000000000003ea Time: 0.0200411
[01/02/2024-22:52:54] [V] [TRT] Tactic: 0x0000000000000000 Time: 0.0230087
[01/02/2024-22:52:54] [V] [TRT] Fastest Tactic: 0x00000000000003ea Time: 0.0200411
[01/02/2024-22:52:54] [V] [TRT] *************** Autotuning Reformat: Float(25088,1,896,32) -> Half(12544,784:2,28,1) ***************
[01/02/2024-22:52:54] [V] [TRT] --------------- Timing Runner: Optimizer Reformat(A-V-1-Relu -> <out>) (Reformat)
[01/02/2024-22:52:54] [V] [TRT] Tactic: 0x00000000000003e8 Time: 0.0258194
[01/02/2024-22:52:54] [V] [TRT] Tactic: 0x00000000000003ea Time: 0.0294053
[01/02/2024-22:52:54] [V] [TRT] Tactic: 0x0000000000000000 Time: 0.0258194
[01/02/2024-22:52:54] [V] [TRT] Fastest Tactic: 0x0000000000000000 Time: 0.0258194
[01/02/2024-22:52:54] [V] [TRT] *************** Autotuning Reformat: Float(6272,1:4,224,8) -> Float(25088,784,28,1) ***************
[01/02/2024-22:52:54] [V] [TRT] --------------- Timing Runner: Optimizer Reformat(A-V-1-Relu -> <out>) (Reformat)
[01/02/2024-22:52:54] [V] [TRT] Tactic: 0x00000000000003e8 Time: 0.0258949
[01/02/2024-22:52:54] [V] [TRT] Tactic: 0x00000000000003ea Time: 0.0608549
[01/02/2024-22:52:54] [V] [TRT] Tactic: 0x0000000000000000 Time: 0.0259467
[01/02/2024-22:52:54] [V] [TRT] Fastest Tactic: 0x00000000000003e8 Time: 0.0258949
[01/02/2024-22:52:54] [V] [TRT] *************** Autotuning Reformat: Float(6272,1:4,224,8) -> Half(25088,784,28,1) ***************
[01/02/2024-22:52:54] [V] [TRT] --------------- Timing Runner: Optimizer Reformat(A-V-1-Relu -> <out>) (Reformat)
[01/02/2024-22:52:54] [V] [TRT] Tactic: 0x00000000000003e8 Time: 0.0258682
[01/02/2024-22:52:54] [V] [TRT] Tactic: 0x00000000000003ea Time: 0.0197486
[01/02/2024-22:52:54] [V] [TRT] Tactic: 0x0000000000000000 Time: 0.0258926
[01/02/2024-22:52:54] [V] [TRT] Fastest Tactic: 0x00000000000003ea Time: 0.0197486
[01/02/2024-22:52:54] [V] [TRT] *************** Autotuning Reformat: Float(6272,1:4,224,8) -> Half(12544,784:2,28,1) ***************
[01/02/2024-22:52:54] [V] [TRT] --------------- Timing Runner: Optimizer Reformat(A-V-1-Relu -> <out>) (Reformat)
[01/02/2024-22:52:54] [V] [TRT] Tactic: 0x00000000000003e8 Time: 0.0291986
[01/02/2024-22:52:54] [V] [TRT] Tactic: 0x00000000000003ea Time: 0.0291109
[01/02/2024-22:52:54] [V] [TRT] Tactic: 0x0000000000000000 Time: 0.0294327
[01/02/2024-22:52:54] [V] [TRT] Fastest Tactic: 0x00000000000003ea Time: 0.0291109
[01/02/2024-22:52:54] [V] [TRT] *************** Autotuning Reformat: Half(25088,784,28,1) -> Float(25088,784,28,1) ***************
[01/02/2024-22:52:54] [V] [TRT] --------------- Timing Runner: Optimizer Reformat(A-V-1-Relu -> <out>) (Reformat)
[01/02/2024-22:52:54] [V] [TRT] Tactic: 0x00000000000003e8 Time: 0.0110741
[01/02/2024-22:52:54] [V] [TRT] Tactic: 0x00000000000003ea Time: 0.0255269
[01/02/2024-22:52:54] [V] [TRT] Tactic: 0x0000000000000000 Time: 0.0190171
[01/02/2024-22:52:54] [V] [TRT] Fastest Tactic: 0x00000000000003e8 Time: 0.0110741
[01/02/2024-22:52:54] [V] [TRT] *************** Autotuning Reformat: Half(25088,784,28,1) -> Float(6272,1:4,224,8) ***************
[01/02/2024-22:52:54] [V] [TRT] --------------- Timing Runner: Optimizer Reformat(A-V-1-Relu -> <out>) (Reformat)
[01/02/2024-22:52:54] [V] [TRT] Tactic: 0x00000000000003e8 Time: 0.0296969
[01/02/2024-22:52:54] [V] [TRT] Tactic: 0x00000000000003ea Time: 0.0196234
[01/02/2024-22:52:54] [V] [TRT] Tactic: 0x0000000000000000 Time: 0.0293449
[01/02/2024-22:52:54] [V] [TRT] Fastest Tactic: 0x00000000000003ea Time: 0.0196234
[01/02/2024-22:52:54] [V] [TRT] *************** Autotuning Reformat: Half(25088,784,28,1) -> Half(12544,784:2,28,1) ***************
[01/02/2024-22:52:54] [V] [TRT] --------------- Timing Runner: Optimizer Reformat(A-V-1-Relu -> <out>) (Reformat)
[01/02/2024-22:52:54] [V] [TRT] Tactic: 0x00000000000003e8 Time: 0.0238202
[01/02/2024-22:52:54] [V] [TRT] Tactic: 0x00000000000003ea Time: 0.02048
[01/02/2024-22:52:54] [V] [TRT] Tactic: 0x0000000000000000 Time: 0.0125562
[01/02/2024-22:52:54] [V] [TRT] Fastest Tactic: 0x0000000000000000 Time: 0.0125562
[01/02/2024-22:52:54] [V] [TRT] *************** Autotuning Reformat: Half(12544,784:2,28,1) -> Float(25088,784,28,1) ***************
[01/02/2024-22:52:54] [V] [TRT] --------------- Timing Runner: Optimizer Reformat(A-V-1-Relu -> <out>) (Reformat)
[01/02/2024-22:52:54] [V] [TRT] Tactic: 0x00000000000003e8 Time: 0.0256975
[01/02/2024-22:52:54] [V] [TRT] Tactic: 0x00000000000003ea Time: 0.0274773
[01/02/2024-22:52:54] [V] [TRT] Tactic: 0x0000000000000000 Time: 0.0144238
[01/02/2024-22:52:54] [V] [TRT] Fastest Tactic: 0x0000000000000000 Time: 0.0144238
[01/02/2024-22:52:54] [V] [TRT] *************** Autotuning Reformat: Half(12544,784:2,28,1) -> Float(6272,1:4,224,8) ***************
[01/02/2024-22:52:54] [V] [TRT] --------------- Timing Runner: Optimizer Reformat(A-V-1-Relu -> <out>) (Reformat)
[01/02/2024-22:52:54] [V] [TRT] Tactic: 0x00000000000003e8 Time: 0.0302811
[01/02/2024-22:52:54] [V] [TRT] Tactic: 0x00000000000003ea Time: 0.0177646
[01/02/2024-22:52:54] [V] [TRT] Tactic: 0x0000000000000000 Time: 0.0303982
[01/02/2024-22:52:54] [V] [TRT] Fastest Tactic: 0x00000000000003ea Time: 0.0177646
[01/02/2024-22:52:54] [V] [TRT] *************** Autotuning Reformat: Half(12544,784:2,28,1) -> Half(25088,784,28,1) ***************
[01/02/2024-22:52:54] [V] [TRT] --------------- Timing Runner: Optimizer Reformat(A-V-1-Relu -> <out>) (Reformat)
[01/02/2024-22:52:54] [V] [TRT] Tactic: 0x00000000000003e8 Time: 0.0232594
[01/02/2024-22:52:54] [V] [TRT] Tactic: 0x00000000000003ea Time: 0.0496396
[01/02/2024-22:52:54] [V] [TRT] Tactic: 0x0000000000000000 Time: 0.011936
[01/02/2024-22:52:54] [V] [TRT] Fastest Tactic: 0x0000000000000000 Time: 0.011936
[01/02/2024-22:52:54] [V] [TRT] =============== Computing reformatting costs: 
[01/02/2024-22:52:54] [V] [TRT] *************** Autotuning Reformat: Float(6272,196,14,1) -> Float(6272,1,448,32) ***************
[01/02/2024-22:52:54] [V] [TRT] --------------- Timing Runner: Optimizer Reformat(A-V-2-MaxPool -> <out>) (Reformat)
[01/02/2024-22:52:54] [V] [TRT] Tactic: 0x00000000000003e8 Time: 0.00813511
[01/02/2024-22:52:54] [V] [TRT] Tactic: 0x00000000000003ea Time: 0.019584
[01/02/2024-22:52:54] [V] [TRT] Tactic: 0x0000000000000000 Time: 0.00820038
[01/02/2024-22:52:54] [V] [TRT] Fastest Tactic: 0x00000000000003e8 Time: 0.00813511
[01/02/2024-22:52:54] [V] [TRT] *************** Autotuning Reformat: Float(6272,196,14,1) -> Float(1568,1:4,112,8) ***************
[01/02/2024-22:52:54] [V] [TRT] --------------- Timing Runner: Optimizer Reformat(A-V-2-MaxPool -> <out>) (Reformat)
[01/02/2024-22:52:54] [V] [TRT] Tactic: 0x00000000000003e8 Time: 0.00840713
[01/02/2024-22:52:54] [V] [TRT] Tactic: 0x00000000000003ea Time: 0.0195474
[01/02/2024-22:52:54] [V] [TRT] Tactic: 0x0000000000000000 Time: 0.00827327
[01/02/2024-22:52:54] [V] [TRT] Fastest Tactic: 0x0000000000000000 Time: 0.00827327
[01/02/2024-22:52:54] [V] [TRT] *************** Autotuning Reformat: Float(6272,196,14,1) -> Half(6272,196,14,1) ***************
[01/02/2024-22:52:54] [V] [TRT] --------------- Timing Runner: Optimizer Reformat(A-V-2-MaxPool -> <out>) (Reformat)
[01/02/2024-22:52:54] [V] [TRT] Tactic: 0x00000000000003e8 Time: 0.00251766
[01/02/2024-22:52:54] [V] [TRT] Tactic: 0x00000000000003ea Time: 0.108983
[01/02/2024-22:52:54] [V] [TRT] Tactic: 0x0000000000000000 Time: 0.00658951
[01/02/2024-22:52:54] [V] [TRT] Fastest Tactic: 0x00000000000003e8 Time: 0.00251766
[01/02/2024-22:52:54] [V] [TRT] *************** Autotuning Reformat: Float(6272,196,14,1) -> Half(3136,196:2,14,1) ***************
[01/02/2024-22:52:54] [V] [TRT] --------------- Timing Runner: Optimizer Reformat(A-V-2-MaxPool -> <out>) (Reformat)
[01/02/2024-22:52:54] [V] [TRT] Tactic: 0x00000000000003e8 Time: 0.00789943
[01/02/2024-22:52:54] [V] [TRT] Tactic: 0x00000000000003ea Time: 0.0116916
[01/02/2024-22:52:54] [V] [TRT] Tactic: 0x0000000000000000 Time: 0.00457143
[01/02/2024-22:52:54] [V] [TRT] Fastest Tactic: 0x0000000000000000 Time: 0.00457143
[01/02/2024-22:52:54] [V] [TRT] *************** Autotuning Reformat: Float(6272,1,448,32) -> Float(6272,196,14,1) ***************
[01/02/2024-22:52:54] [V] [TRT] --------------- Timing Runner: Optimizer Reformat(A-V-2-MaxPool -> <out>) (Reformat)
[01/02/2024-22:52:54] [V] [TRT] Tactic: 0x00000000000003e8 Time: 0.00704261
[01/02/2024-22:52:54] [V] [TRT] Tactic: 0x00000000000003ea Time: 0.0191817
[01/02/2024-22:52:54] [V] [TRT] Tactic: 0x0000000000000000 Time: 0.00694509
[01/02/2024-22:52:54] [V] [TRT] Fastest Tactic: 0x0000000000000000 Time: 0.00694509
[01/02/2024-22:52:54] [V] [TRT] *************** Autotuning Reformat: Float(6272,1,448,32) -> Float(1568,1:4,112,8) ***************
[01/02/2024-22:52:54] [V] [TRT] --------------- Timing Runner: Optimizer Reformat(A-V-2-MaxPool -> <out>) (Reformat)
[01/02/2024-22:52:54] [V] [TRT] Tactic: 0x00000000000003e8 Time: 0.00824889
[01/02/2024-22:52:54] [V] [TRT] Tactic: 0x00000000000003ea Time: 0.0164815
[01/02/2024-22:52:54] [V] [TRT] Tactic: 0x0000000000000000 Time: 0.00815137
[01/02/2024-22:52:54] [V] [TRT] Fastest Tactic: 0x0000000000000000 Time: 0.00815137
[01/02/2024-22:52:54] [V] [TRT] *************** Autotuning Reformat: Float(6272,1,448,32) -> Half(6272,196,14,1) ***************
[01/02/2024-22:52:54] [V] [TRT] --------------- Timing Runner: Optimizer Reformat(A-V-2-MaxPool -> <out>) (Reformat)
[01/02/2024-22:52:54] [V] [TRT] Tactic: 0x00000000000003e8 Time: 0.00697295
[01/02/2024-22:52:54] [V] [TRT] Tactic: 0x00000000000003ea Time: 0.009152
[01/02/2024-22:52:54] [V] [TRT] Tactic: 0x0000000000000000 Time: 0.00700082
[01/02/2024-22:52:54] [V] [TRT] Fastest Tactic: 0x00000000000003e8 Time: 0.00697295
[01/02/2024-22:52:54] [V] [TRT] *************** Autotuning Reformat: Float(6272,1,448,32) -> Half(3136,196:2,14,1) ***************
[01/02/2024-22:52:54] [V] [TRT] --------------- Timing Runner: Optimizer Reformat(A-V-2-MaxPool -> <out>) (Reformat)
[01/02/2024-22:52:54] [V] [TRT] Tactic: 0x00000000000003e8 Time: 0.00793023
[01/02/2024-22:52:54] [V] [TRT] Tactic: 0x00000000000003ea Time: 0.0100937
[01/02/2024-22:52:54] [V] [TRT] Tactic: 0x0000000000000000 Time: 0.00803759
[01/02/2024-22:52:54] [V] [TRT] Fastest Tactic: 0x00000000000003e8 Time: 0.00793023
[01/02/2024-22:52:54] [V] [TRT] *************** Autotuning Reformat: Float(1568,1:4,112,8) -> Float(6272,196,14,1) ***************
[01/02/2024-22:52:54] [V] [TRT] --------------- Timing Runner: Optimizer Reformat(A-V-2-MaxPool -> <out>) (Reformat)
[01/02/2024-22:52:54] [V] [TRT] Tactic: 0x00000000000003e8 Time: 0.00785323
[01/02/2024-22:52:54] [V] [TRT] Tactic: 0x00000000000003ea Time: 0.0191634
[01/02/2024-22:52:54] [V] [TRT] Tactic: 0x0000000000000000 Time: 0.00735086
[01/02/2024-22:52:54] [V] [TRT] Fastest Tactic: 0x0000000000000000 Time: 0.00735086
[01/02/2024-22:52:54] [V] [TRT] *************** Autotuning Reformat: Float(1568,1:4,112,8) -> Float(6272,1,448,32) ***************
[01/02/2024-22:52:54] [V] [TRT] --------------- Timing Runner: Optimizer Reformat(A-V-2-MaxPool -> <out>) (Reformat)
[01/02/2024-22:52:54] [V] [TRT] Tactic: 0x00000000000003e8 Time: 0.00743863
[01/02/2024-22:52:54] [V] [TRT] Tactic: 0x00000000000003ea Time: 0.0152288
[01/02/2024-22:52:54] [V] [TRT] Tactic: 0x0000000000000000 Time: 0.00746788
[01/02/2024-22:52:54] [V] [TRT] Fastest Tactic: 0x00000000000003e8 Time: 0.00743863
[01/02/2024-22:52:54] [V] [TRT] *************** Autotuning Reformat: Float(1568,1:4,112,8) -> Half(6272,196,14,1) ***************
[01/02/2024-22:52:54] [V] [TRT] --------------- Timing Runner: Optimizer Reformat(A-V-2-MaxPool -> <out>) (Reformat)
[01/02/2024-22:52:54] [V] [TRT] Tactic: 0x00000000000003e8 Time: 0.00733623
[01/02/2024-22:52:54] [V] [TRT] Tactic: 0x00000000000003ea Time: 0.00843294
[01/02/2024-22:52:54] [V] [TRT] Tactic: 0x0000000000000000 Time: 0.0074384
[01/02/2024-22:52:54] [V] [TRT] Fastest Tactic: 0x00000000000003e8 Time: 0.00733623
[01/02/2024-22:52:54] [V] [TRT] *************** Autotuning Reformat: Float(1568,1:4,112,8) -> Half(3136,196:2,14,1) ***************
[01/02/2024-22:52:54] [V] [TRT] --------------- Timing Runner: Optimizer Reformat(A-V-2-MaxPool -> <out>) (Reformat)
[01/02/2024-22:52:54] [V] [TRT] Tactic: 0x00000000000003e8 Time: 0.00827327
[01/02/2024-22:52:54] [V] [TRT] Tactic: 0x00000000000003ea Time: 0.009344
[01/02/2024-22:52:54] [V] [TRT] Tactic: 0x0000000000000000 Time: 0.00822451
[01/02/2024-22:52:54] [V] [TRT] Fastest Tactic: 0x0000000000000000 Time: 0.00822451
[01/02/2024-22:52:54] [V] [TRT] *************** Autotuning Reformat: Half(6272,196,14,1) -> Float(6272,196,14,1) ***************
[01/02/2024-22:52:54] [V] [TRT] --------------- Timing Runner: Optimizer Reformat(A-V-2-MaxPool -> <out>) (Reformat)
[01/02/2024-22:52:54] [V] [TRT] Tactic: 0x00000000000003e8 Time: 0.00242239
[01/02/2024-22:52:54] [V] [TRT] Tactic: 0x00000000000003ea Time: 0.103351
[01/02/2024-22:52:54] [V] [TRT] Tactic: 0x0000000000000000 Time: 0.00554198
[01/02/2024-22:52:54] [V] [TRT] Fastest Tactic: 0x00000000000003e8 Time: 0.00242239
[01/02/2024-22:52:54] [V] [TRT] *************** Autotuning Reformat: Half(6272,196,14,1) -> Float(6272,1,448,32) ***************
[01/02/2024-22:52:54] [V] [TRT] --------------- Timing Runner: Optimizer Reformat(A-V-2-MaxPool -> <out>) (Reformat)
[01/02/2024-22:52:54] [V] [TRT] Tactic: 0x00000000000003e8 Time: 0.00765305
[01/02/2024-22:52:54] [V] [TRT] Tactic: 0x00000000000003ea Time: 0.00718994
[01/02/2024-22:52:54] [V] [TRT] Tactic: 0x0000000000000000 Time: 0.00763765
[01/02/2024-22:52:54] [V] [TRT] Fastest Tactic: 0x00000000000003ea Time: 0.00718994
[01/02/2024-22:52:54] [V] [TRT] *************** Autotuning Reformat: Half(6272,196,14,1) -> Float(1568,1:4,112,8) ***************
[01/02/2024-22:52:54] [V] [TRT] --------------- Timing Runner: Optimizer Reformat(A-V-2-MaxPool -> <out>) (Reformat)
[01/02/2024-22:52:54] [V] [TRT] Tactic: 0x00000000000003e8 Time: 0.00775314
[01/02/2024-22:52:54] [V] [TRT] Tactic: 0x00000000000003ea Time: 0.00714606
[01/02/2024-22:52:54] [V] [TRT] Tactic: 0x0000000000000000 Time: 0.00775314
[01/02/2024-22:52:54] [V] [TRT] Fastest Tactic: 0x00000000000003ea Time: 0.00714606
[01/02/2024-22:52:54] [V] [TRT] *************** Autotuning Reformat: Half(6272,196,14,1) -> Half(3136,196:2,14,1) ***************
[01/02/2024-22:52:54] [V] [TRT] --------------- Timing Runner: Optimizer Reformat(A-V-2-MaxPool -> <out>) (Reformat)
[01/02/2024-22:52:54] [V] [TRT] Tactic: 0x00000000000003e8 Time: 0.00687543
[01/02/2024-22:52:54] [V] [TRT] Tactic: 0x00000000000003ea Time: 0.00966461
[01/02/2024-22:52:54] [V] [TRT] Tactic: 0x0000000000000000 Time: 0.00417554
[01/02/2024-22:52:54] [V] [TRT] Fastest Tactic: 0x0000000000000000 Time: 0.00417554
[01/02/2024-22:52:54] [V] [TRT] *************** Autotuning Reformat: Half(3136,196:2,14,1) -> Float(6272,196,14,1) ***************
[01/02/2024-22:52:54] [V] [TRT] --------------- Timing Runner: Optimizer Reformat(A-V-2-MaxPool -> <out>) (Reformat)
[01/02/2024-22:52:54] [V] [TRT] Tactic: 0x00000000000003e8 Time: 0.0073216
[01/02/2024-22:52:54] [V] [TRT] Tactic: 0x00000000000003ea Time: 0.0106684
[01/02/2024-22:52:54] [V] [TRT] Tactic: 0x0000000000000000 Time: 0.00402286
[01/02/2024-22:52:54] [V] [TRT] Fastest Tactic: 0x0000000000000000 Time: 0.00402286
[01/02/2024-22:52:54] [V] [TRT] *************** Autotuning Reformat: Half(3136,196:2,14,1) -> Float(6272,1,448,32) ***************
[01/02/2024-22:52:54] [V] [TRT] --------------- Timing Runner: Optimizer Reformat(A-V-2-MaxPool -> <out>) (Reformat)
[01/02/2024-22:52:54] [V] [TRT] Tactic: 0x00000000000003e8 Time: 0.00761456
[01/02/2024-22:52:54] [V] [TRT] Tactic: 0x00000000000003ea Time: 0.00660945
[01/02/2024-22:52:54] [V] [TRT] Tactic: 0x0000000000000000 Time: 0.00753756
[01/02/2024-22:52:54] [V] [TRT] Fastest Tactic: 0x00000000000003ea Time: 0.00660945
[01/02/2024-22:52:54] [V] [TRT] *************** Autotuning Reformat: Half(3136,196:2,14,1) -> Float(1568,1:4,112,8) ***************
[01/02/2024-22:52:54] [V] [TRT] --------------- Timing Runner: Optimizer Reformat(A-V-2-MaxPool -> <out>) (Reformat)
[01/02/2024-22:52:54] [V] [TRT] Tactic: 0x00000000000003e8 Time: 0.00847597
[01/02/2024-22:52:54] [V] [TRT] Tactic: 0x00000000000003ea Time: 0.00658286
[01/02/2024-22:52:54] [V] [TRT] Tactic: 0x0000000000000000 Time: 0.00851039
[01/02/2024-22:52:54] [V] [TRT] Fastest Tactic: 0x00000000000003ea Time: 0.00658286
[01/02/2024-22:52:54] [V] [TRT] *************** Autotuning Reformat: Half(3136,196:2,14,1) -> Half(6272,196,14,1) ***************
[01/02/2024-22:52:54] [V] [TRT] --------------- Timing Runner: Optimizer Reformat(A-V-2-MaxPool -> <out>) (Reformat)
[01/02/2024-22:52:54] [V] [TRT] Tactic: 0x00000000000003e8 Time: 0.00684757
[01/02/2024-22:52:54] [V] [TRT] Tactic: 0x00000000000003ea Time: 0.0177168
[01/02/2024-22:52:54] [V] [TRT] Tactic: 0x0000000000000000 Time: 0.00398628
[01/02/2024-22:52:54] [V] [TRT] Fastest Tactic: 0x0000000000000000 Time: 0.00398628
[01/02/2024-22:52:54] [V] [TRT] =============== Computing reformatting costs: 
[01/02/2024-22:52:54] [V] [TRT] *************** Autotuning Reformat: Float(12544,196,14,1) -> Float(3136,1:4,224,16) ***************
[01/02/2024-22:52:54] [V] [TRT] --------------- Timing Runner: Optimizer Reformat(A-V-4-Relu -> <out>) (Reformat)
[01/02/2024-22:52:54] [V] [TRT] Tactic: 0x00000000000003e8 Time: 0.013312
[01/02/2024-22:52:54] [V] [TRT] Tactic: 0x00000000000003ea Time: 0.0177168
[01/02/2024-22:52:54] [V] [TRT] Tactic: 0x0000000000000000 Time: 0.013312
[01/02/2024-22:52:54] [V] [TRT] Fastest Tactic: 0x00000000000003e8 Time: 0.013312
[01/02/2024-22:52:54] [V] [TRT] *************** Autotuning Reformat: Float(12544,196,14,1) -> Half(12544,196,14,1) ***************
[01/02/2024-22:52:54] [V] [TRT] --------------- Timing Runner: Optimizer Reformat(A-V-4-Relu -> <out>) (Reformat)
[01/02/2024-22:52:54] [V] [TRT] Tactic: 0x00000000000003e8 Time: 0.00286135
[01/02/2024-22:52:54] [V] [TRT] Tactic: 0x00000000000003ea Time: 0.198217
[01/02/2024-22:52:54] [V] [TRT] Tactic: 0x0000000000000000 Time: 0.0103654
[01/02/2024-22:52:54] [V] [TRT] Fastest Tactic: 0x00000000000003e8 Time: 0.00286135
[01/02/2024-22:52:54] [V] [TRT] *************** Autotuning Reformat: Float(12544,196,14,1) -> Half(6272,196:2,14,1) ***************
[01/02/2024-22:52:54] [V] [TRT] --------------- Timing Runner: Optimizer Reformat(A-V-4-Relu -> <out>) (Reformat)
[01/02/2024-22:52:54] [V] [TRT] Tactic: 0x00000000000003e8 Time: 0.0126781
[01/02/2024-22:52:54] [V] [TRT] Tactic: 0x00000000000003ea Time: 0.0176843
[01/02/2024-22:52:54] [V] [TRT] Tactic: 0x0000000000000000 Time: 0.00674888
[01/02/2024-22:52:54] [V] [TRT] Fastest Tactic: 0x0000000000000000 Time: 0.00674888
[01/02/2024-22:52:54] [V] [TRT] *************** Autotuning Reformat: Float(12544,1,896,64) -> Float(12544,196,14,1) ***************
[01/02/2024-22:52:54] [V] [TRT] --------------- Timing Runner: Optimizer Reformat(A-V-4-Relu -> <out>) (Reformat)
[01/02/2024-22:52:54] [V] [TRT] Tactic: 0x00000000000003e8 Time: 0.0108565
[01/02/2024-22:52:54] [V] [TRT] Tactic: 0x00000000000003ea Time: 0.0204591
[01/02/2024-22:52:54] [V] [TRT] Tactic: 0x0000000000000000 Time: 0.010846
[01/02/2024-22:52:54] [V] [TRT] Fastest Tactic: 0x0000000000000000 Time: 0.010846
[01/02/2024-22:52:54] [V] [TRT] *************** Autotuning Reformat: Float(12544,1,896,64) -> Float(3136,1:4,224,16) ***************
[01/02/2024-22:52:54] [V] [TRT] --------------- Timing Runner: Optimizer Reformat(A-V-4-Relu -> <out>) (Reformat)
[01/02/2024-22:52:54] [V] [TRT] Tactic: 0x00000000000003e8 Time: 0.0131923
[01/02/2024-22:52:54] [V] [TRT] Tactic: 0x00000000000003ea Time: 0.0139237
[01/02/2024-22:52:54] [V] [TRT] Tactic: 0x0000000000000000 Time: 0.0131387
[01/02/2024-22:52:54] [V] [TRT] Fastest Tactic: 0x0000000000000000 Time: 0.0131387
[01/02/2024-22:52:54] [V] [TRT] *************** Autotuning Reformat: Float(12544,1,896,64) -> Half(12544,196,14,1) ***************
[01/02/2024-22:52:54] [V] [TRT] --------------- Timing Runner: Optimizer Reformat(A-V-4-Relu -> <out>) (Reformat)
[01/02/2024-22:52:54] [V] [TRT] Tactic: 0x00000000000003e8 Time: 0.0110615
[01/02/2024-22:52:54] [V] [TRT] Tactic: 0x00000000000003ea Time: 0.0126537
[01/02/2024-22:52:54] [V] [TRT] Tactic: 0x0000000000000000 Time: 0.011084
[01/02/2024-22:52:54] [V] [TRT] Fastest Tactic: 0x00000000000003e8 Time: 0.0110615
[01/02/2024-22:52:54] [V] [TRT] *************** Autotuning Reformat: Float(12544,1,896,64) -> Half(6272,196:2,14,1) ***************
[01/02/2024-22:52:54] [V] [TRT] --------------- Timing Runner: Optimizer Reformat(A-V-4-Relu -> <out>) (Reformat)
[01/02/2024-22:52:54] [V] [TRT] Tactic: 0x00000000000003e8 Time: 0.0127269
[01/02/2024-22:52:54] [V] [TRT] Tactic: 0x00000000000003ea Time: 0.0151845
[01/02/2024-22:52:54] [V] [TRT] Tactic: 0x0000000000000000 Time: 0.0127025
[01/02/2024-22:52:54] [V] [TRT] Fastest Tactic: 0x0000000000000000 Time: 0.0127025
[01/02/2024-22:52:54] [V] [TRT] *************** Autotuning Reformat: Float(3136,1:4,224,16) -> Float(12544,196,14,1) ***************
[01/02/2024-22:52:54] [V] [TRT] --------------- Timing Runner: Optimizer Reformat(A-V-4-Relu -> <out>) (Reformat)
[01/02/2024-22:52:54] [V] [TRT] Tactic: 0x00000000000003e8 Time: 0.0125684
[01/02/2024-22:52:54] [V] [TRT] Tactic: 0x00000000000003ea Time: 0.0205009
[01/02/2024-22:52:54] [V] [TRT] Tactic: 0x0000000000000000 Time: 0.0124949
[01/02/2024-22:52:54] [V] [TRT] Fastest Tactic: 0x0000000000000000 Time: 0.0124949
[01/02/2024-22:52:54] [V] [TRT] *************** Autotuning Reformat: Float(3136,1:4,224,16) -> Half(12544,196,14,1) ***************
[01/02/2024-22:52:54] [V] [TRT] --------------- Timing Runner: Optimizer Reformat(A-V-4-Relu -> <out>) (Reformat)
[01/02/2024-22:52:54] [V] [TRT] Tactic: 0x00000000000003e8 Time: 0.0128
[01/02/2024-22:52:54] [V] [TRT] Tactic: 0x00000000000003ea Time: 0.0126171
[01/02/2024-22:52:54] [V] [TRT] Tactic: 0x0000000000000000 Time: 0.0126781
[01/02/2024-22:52:54] [V] [TRT] Fastest Tactic: 0x00000000000003ea Time: 0.0126171
[01/02/2024-22:52:54] [V] [TRT] *************** Autotuning Reformat: Float(3136,1:4,224,16) -> Half(6272,196:2,14,1) ***************
[01/02/2024-22:52:54] [V] [TRT] --------------- Timing Runner: Optimizer Reformat(A-V-4-Relu -> <out>) (Reformat)
[01/02/2024-22:52:54] [V] [TRT] Tactic: 0x00000000000003e8 Time: 0.0144384
[01/02/2024-22:52:54] [V] [TRT] Tactic: 0x00000000000003ea Time: 0.0152722
[01/02/2024-22:52:54] [V] [TRT] Tactic: 0x0000000000000000 Time: 0.0145115
[01/02/2024-22:52:54] [V] [TRT] Fastest Tactic: 0x00000000000003e8 Time: 0.0144384
[01/02/2024-22:52:54] [V] [TRT] *************** Autotuning Reformat: Half(12544,196,14,1) -> Float(12544,196,14,1) ***************
[01/02/2024-22:52:54] [V] [TRT] --------------- Timing Runner: Optimizer Reformat(A-V-4-Relu -> <out>) (Reformat)
[01/02/2024-22:52:54] [V] [TRT] Tactic: 0x00000000000003e8 Time: 0.00312596
[01/02/2024-22:52:54] [V] [TRT] Tactic: 0x00000000000003ea Time: 0.203483
[01/02/2024-22:52:54] [V] [TRT] Tactic: 0x0000000000000000 Time: 0.00920686
[01/02/2024-22:52:54] [V] [TRT] Fastest Tactic: 0x00000000000003e8 Time: 0.00312596
[01/02/2024-22:52:54] [V] [TRT] *************** Autotuning Reformat: Half(12544,196,14,1) -> Float(3136,1:4,224,16) ***************
[01/02/2024-22:52:54] [V] [TRT] --------------- Timing Runner: Optimizer Reformat(A-V-4-Relu -> <out>) (Reformat)
[01/02/2024-22:52:54] [V] [TRT] Tactic: 0x00000000000003e8 Time: 0.0133652
[01/02/2024-22:52:54] [V] [TRT] Tactic: 0x00000000000003ea Time: 0.0108983
[01/02/2024-22:52:54] [V] [TRT] Tactic: 0x0000000000000000 Time: 0.0133519
[01/02/2024-22:52:54] [V] [TRT] Fastest Tactic: 0x00000000000003ea Time: 0.0108983
[01/02/2024-22:52:54] [V] [TRT] *************** Autotuning Reformat: Half(12544,196,14,1) -> Half(6272,196:2,14,1) ***************
[01/02/2024-22:52:54] [V] [TRT] --------------- Timing Runner: Optimizer Reformat(A-V-4-Relu -> <out>) (Reformat)
[01/02/2024-22:52:54] [V] [TRT] Tactic: 0x00000000000003e8 Time: 0.0119467
[01/02/2024-22:52:54] [V] [TRT] Tactic: 0x00000000000003ea Time: 0.0124465
[01/02/2024-22:52:54] [V] [TRT] Tactic: 0x0000000000000000 Time: 0.00657538
[01/02/2024-22:52:54] [V] [TRT] Fastest Tactic: 0x0000000000000000 Time: 0.00657538
[01/02/2024-22:52:54] [V] [TRT] *************** Autotuning Reformat: Half(6272,196:2,14,1) -> Float(12544,196,14,1) ***************
[01/02/2024-22:52:54] [V] [TRT] --------------- Timing Runner: Optimizer Reformat(A-V-4-Relu -> <out>) (Reformat)
[01/02/2024-22:52:54] [V] [TRT] Tactic: 0x00000000000003e8 Time: 0.0126415
[01/02/2024-22:52:54] [V] [TRT] Tactic: 0x00000000000003ea Time: 0.0177981
[01/02/2024-22:52:54] [V] [TRT] Tactic: 0x0000000000000000 Time: 0.00626484
[01/02/2024-22:52:54] [V] [TRT] Fastest Tactic: 0x0000000000000000 Time: 0.00626484
[01/02/2024-22:52:54] [V] [TRT] *************** Autotuning Reformat: Half(6272,196:2,14,1) -> Float(3136,1:4,224,16) ***************
[01/02/2024-22:52:54] [V] [TRT] --------------- Timing Runner: Optimizer Reformat(A-V-4-Relu -> <out>) (Reformat)
[01/02/2024-22:52:54] [V] [TRT] Tactic: 0x00000000000003e8 Time: 0.0149943
[01/02/2024-22:52:54] [V] [TRT] Tactic: 0x00000000000003ea Time: 0.00994743
[01/02/2024-22:52:54] [V] [TRT] Tactic: 0x0000000000000000 Time: 0.0149943
[01/02/2024-22:52:54] [V] [TRT] Fastest Tactic: 0x00000000000003ea Time: 0.00994743
[01/02/2024-22:52:54] [V] [TRT] *************** Autotuning Reformat: Half(6272,196:2,14,1) -> Half(12544,196,14,1) ***************
[01/02/2024-22:52:54] [V] [TRT] --------------- Timing Runner: Optimizer Reformat(A-V-4-Relu -> <out>) (Reformat)
[01/02/2024-22:52:54] [V] [TRT] Tactic: 0x00000000000003e8 Time: 0.0119832
[01/02/2024-22:52:54] [V] [TRT] Tactic: 0x00000000000003ea Time: 0.0239421
[01/02/2024-22:52:54] [V] [TRT] Tactic: 0x0000000000000000 Time: 0.00626484
[01/02/2024-22:52:54] [V] [TRT] Fastest Tactic: 0x0000000000000000 Time: 0.00626484
[01/02/2024-22:52:54] [V] [TRT] =============== Computing reformatting costs: 
[01/02/2024-22:52:54] [V] [TRT] *************** Autotuning Reformat: Float(3136,49,7,1) -> Float(3136,1,448,64) ***************
[01/02/2024-22:52:54] [V] [TRT] --------------- Timing Runner: Optimizer Reformat(A-V-5-MaxPool -> <out>) (Reformat)
[01/02/2024-22:52:54] [V] [TRT] Tactic: 0x00000000000003e8 Time: 0.00510955
[01/02/2024-22:52:54] [V] [TRT] Tactic: 0x00000000000003ea Time: 0.0154185
[01/02/2024-22:52:54] [V] [TRT] Tactic: 0x0000000000000000 Time: 0.00513567
[01/02/2024-22:52:54] [V] [TRT] Fastest Tactic: 0x00000000000003e8 Time: 0.00510955
[01/02/2024-22:52:54] [V] [TRT] *************** Autotuning Reformat: Float(3136,49,7,1) -> Float(784,1:4,112,16) ***************
[01/02/2024-22:52:54] [V] [TRT] --------------- Timing Runner: Optimizer Reformat(A-V-5-MaxPool -> <out>) (Reformat)
[01/02/2024-22:52:54] [V] [TRT] Tactic: 0x00000000000003e8 Time: 0.00519837
[01/02/2024-22:52:54] [V] [TRT] Tactic: 0x00000000000003ea Time: 0.0154478
[01/02/2024-22:52:54] [V] [TRT] Tactic: 0x0000000000000000 Time: 0.00522449
[01/02/2024-22:52:54] [V] [TRT] Fastest Tactic: 0x00000000000003e8 Time: 0.00519837
[01/02/2024-22:52:54] [V] [TRT] *************** Autotuning Reformat: Float(3136,49,7,1) -> Float(98,49:32,7,1) ***************
[01/02/2024-22:52:54] [V] [TRT] --------------- Timing Runner: Optimizer Reformat(A-V-5-MaxPool -> <out>) (Reformat)
[01/02/2024-22:52:54] [V] [TRT] Tactic: 0x00000000000003e8 Time: 0.00760686
[01/02/2024-22:52:54] [V] [TRT] Tactic: 0x00000000000003ea Time: 0.0166278
[01/02/2024-22:52:54] [V] [TRT] Tactic: 0x0000000000000000 Time: 0.00753371
[01/02/2024-22:52:54] [V] [TRT] Fastest Tactic: 0x0000000000000000 Time: 0.00753371
[01/02/2024-22:52:54] [V] [TRT] *************** Autotuning Reformat: Float(3136,49,7,1) -> Half(3136,49,7,1) ***************
[01/02/2024-22:52:54] [V] [TRT] --------------- Timing Runner: Optimizer Reformat(A-V-5-MaxPool -> <out>) (Reformat)
[01/02/2024-22:52:54] [V] [TRT] Tactic: 0x00000000000003e8 Time: 0.00194323
[01/02/2024-22:52:54] [V] [TRT] Tactic: 0x00000000000003ea Time: 0.0587581
[01/02/2024-22:52:54] [V] [TRT] Tactic: 0x0000000000000000 Time: 0.00442403
[01/02/2024-22:52:54] [V] [TRT] Fastest Tactic: 0x00000000000003e8 Time: 0.00194323
[01/02/2024-22:52:54] [V] [TRT] *************** Autotuning Reformat: Float(3136,49,7,1) -> Half(1568,49:2,7,1) ***************
[01/02/2024-22:52:54] [V] [TRT] --------------- Timing Runner: Optimizer Reformat(A-V-5-MaxPool -> <out>) (Reformat)
[01/02/2024-22:52:54] [V] [TRT] Tactic: 0x00000000000003e8 Time: 0.00465283
[01/02/2024-22:52:54] [V] [TRT] Tactic: 0x00000000000003ea Time: 0.00794819
[01/02/2024-22:52:54] [V] [TRT] Tactic: 0x0000000000000000 Time: 0.00305342
[01/02/2024-22:52:54] [V] [TRT] Fastest Tactic: 0x0000000000000000 Time: 0.00305342
[01/02/2024-22:52:54] [V] [TRT] *************** Autotuning Reformat: Float(3136,1,448,64) -> Float(3136,49,7,1) ***************
[01/02/2024-22:52:54] [V] [TRT] --------------- Timing Runner: Optimizer Reformat(A-V-5-MaxPool -> <out>) (Reformat)
[01/02/2024-22:52:54] [V] [TRT] Tactic: 0x00000000000003e8 Time: 0.00454857
[01/02/2024-22:52:54] [V] [TRT] Tactic: 0x00000000000003ea Time: 0.0158964
[01/02/2024-22:52:54] [V] [TRT] Tactic: 0x0000000000000000 Time: 0.00447543
[01/02/2024-22:52:54] [V] [TRT] Fastest Tactic: 0x0000000000000000 Time: 0.00447543
[01/02/2024-22:52:54] [V] [TRT] *************** Autotuning Reformat: Float(3136,1,448,64) -> Float(784,1:4,112,16) ***************
[01/02/2024-22:52:54] [V] [TRT] --------------- Timing Runner: Optimizer Reformat(A-V-5-MaxPool -> <out>) (Reformat)
[01/02/2024-22:52:54] [V] [TRT] Tactic: 0x00000000000003e8 Time: 0.00480792
[01/02/2024-22:52:54] [V] [TRT] Tactic: 0x00000000000003ea Time: 0.0137775
[01/02/2024-22:52:54] [V] [TRT] Tactic: 0x0000000000000000 Time: 0.00476404
[01/02/2024-22:52:54] [V] [TRT] Fastest Tactic: 0x0000000000000000 Time: 0.00476404
[01/02/2024-22:52:54] [V] [TRT] *************** Autotuning Reformat: Float(3136,1,448,64) -> Float(98,49:32,7,1) ***************
[01/02/2024-22:52:54] [V] [TRT] --------------- Timing Runner: Optimizer Reformat(A-V-5-MaxPool -> <out>) (Reformat)
[01/02/2024-22:52:54] [V] [TRT] Tactic: 0x00000000000003e8 Time: 0.00845876
[01/02/2024-22:52:54] [V] [TRT] Tactic: 0x00000000000003ea Time: 0.0137509
[01/02/2024-22:52:54] [V] [TRT] Tactic: 0x0000000000000000 Time: 0.00851899
[01/02/2024-22:52:54] [V] [TRT] Fastest Tactic: 0x00000000000003e8 Time: 0.00845876
[01/02/2024-22:52:54] [V] [TRT] *************** Autotuning Reformat: Float(3136,1,448,64) -> Half(3136,49,7,1) ***************
[01/02/2024-22:52:54] [V] [TRT] --------------- Timing Runner: Optimizer Reformat(A-V-5-MaxPool -> <out>) (Reformat)
[01/02/2024-22:52:54] [V] [TRT] Tactic: 0x00000000000003e8 Time: 0.00449371
[01/02/2024-22:52:54] [V] [TRT] Tactic: 0x00000000000003ea Time: 0.00630937
[01/02/2024-22:52:54] [V] [TRT] Tactic: 0x0000000000000000 Time: 0.00445964
[01/02/2024-22:52:54] [V] [TRT] Fastest Tactic: 0x0000000000000000 Time: 0.00445964
[01/02/2024-22:52:54] [V] [TRT] *************** Autotuning Reformat: Float(3136,1,448,64) -> Half(1568,49:2,7,1) ***************
[01/02/2024-22:52:54] [V] [TRT] --------------- Timing Runner: Optimizer Reformat(A-V-5-MaxPool -> <out>) (Reformat)
[01/02/2024-22:52:54] [V] [TRT] Tactic: 0x00000000000003e8 Time: 0.00480305
[01/02/2024-22:52:54] [V] [TRT] Tactic: 0x00000000000003ea Time: 0.00708441
[01/02/2024-22:52:54] [V] [TRT] Tactic: 0x0000000000000000 Time: 0.00477867
[01/02/2024-22:52:54] [V] [TRT] Fastest Tactic: 0x0000000000000000 Time: 0.00477867
[01/02/2024-22:52:54] [V] [TRT] *************** Autotuning Reformat: Float(784,1:4,112,16) -> Float(3136,49,7,1) ***************
[01/02/2024-22:52:54] [V] [TRT] --------------- Timing Runner: Optimizer Reformat(A-V-5-MaxPool -> <out>) (Reformat)
[01/02/2024-22:52:54] [V] [TRT] Tactic: 0x00000000000003e8 Time: 0.00470946
[01/02/2024-22:52:54] [V] [TRT] Tactic: 0x00000000000003ea Time: 0.0158801
[01/02/2024-22:52:54] [V] [TRT] Tactic: 0x0000000000000000 Time: 0.00474721
[01/02/2024-22:52:54] [V] [TRT] Fastest Tactic: 0x00000000000003e8 Time: 0.00470946
[01/02/2024-22:52:54] [V] [TRT] *************** Autotuning Reformat: Float(784,1:4,112,16) -> Float(3136,1,448,64) ***************
[01/02/2024-22:52:54] [V] [TRT] --------------- Timing Runner: Optimizer Reformat(A-V-5-MaxPool -> <out>) (Reformat)
[01/02/2024-22:52:54] [V] [TRT] Tactic: 0x00000000000003e8 Time: 0.00474249
[01/02/2024-22:52:54] [V] [TRT] Tactic: 0x00000000000003ea Time: 0.0138041
[01/02/2024-22:52:54] [V] [TRT] Tactic: 0x0000000000000000 Time: 0.00470002
[01/02/2024-22:52:54] [V] [TRT] Fastest Tactic: 0x0000000000000000 Time: 0.00470002
[01/02/2024-22:52:54] [V] [TRT] *************** Autotuning Reformat: Float(784,1:4,112,16) -> Float(98,49:32,7,1) ***************
[01/02/2024-22:52:54] [V] [TRT] --------------- Timing Runner: Optimizer Reformat(A-V-5-MaxPool -> <out>) (Reformat)
[01/02/2024-22:52:54] [V] [TRT] Tactic: 0x00000000000003e8 Time: 0.00862225
[01/02/2024-22:52:54] [V] [TRT] Tactic: 0x00000000000003ea Time: 0.0137642
[01/02/2024-22:52:54] [V] [TRT] Tactic: 0x0000000000000000 Time: 0.00859644
[01/02/2024-22:52:54] [V] [TRT] Fastest Tactic: 0x0000000000000000 Time: 0.00859644
[01/02/2024-22:52:54] [V] [TRT] *************** Autotuning Reformat: Float(784,1:4,112,16) -> Half(3136,49,7,1) ***************
[01/02/2024-22:52:54] [V] [TRT] --------------- Timing Runner: Optimizer Reformat(A-V-5-MaxPool -> <out>) (Reformat)
[01/02/2024-22:52:54] [V] [TRT] Tactic: 0x00000000000003e8 Time: 0.00475193
[01/02/2024-22:52:54] [V] [TRT] Tactic: 0x00000000000003ea Time: 0.00597333
[01/02/2024-22:52:54] [V] [TRT] Tactic: 0x0000000000000000 Time: 0.00473777
[01/02/2024-22:52:54] [V] [TRT] Fastest Tactic: 0x0000000000000000 Time: 0.00473777
[01/02/2024-22:52:54] [V] [TRT] *************** Autotuning Reformat: Float(784,1:4,112,16) -> Half(1568,49:2,7,1) ***************
[01/02/2024-22:52:54] [V] [TRT] --------------- Timing Runner: Optimizer Reformat(A-V-5-MaxPool -> <out>) (Reformat)
[01/02/2024-22:52:54] [V] [TRT] Tactic: 0x00000000000003e8 Time: 0.0053313
[01/02/2024-22:52:54] [V] [TRT] Tactic: 0x00000000000003ea Time: 0.00702171
[01/02/2024-22:52:54] [V] [TRT] Tactic: 0x0000000000000000 Time: 0.00523494
[01/02/2024-22:52:54] [V] [TRT] Fastest Tactic: 0x0000000000000000 Time: 0.00523494
[01/02/2024-22:52:54] [V] [TRT] *************** Autotuning Reformat: Float(98,49:32,7,1) -> Float(3136,49,7,1) ***************
[01/02/2024-22:52:54] [V] [TRT] --------------- Timing Runner: Optimizer Reformat(A-V-5-MaxPool -> <out>) (Reformat)
[01/02/2024-22:52:54] [V] [TRT] Tactic: 0x00000000000003e8 Time: 0.00477379
[01/02/2024-22:52:54] [V] [TRT] Tactic: 0x00000000000003ea Time: 0.0159126
[01/02/2024-22:52:54] [V] [TRT] Tactic: 0x0000000000000000 Time: 0.00474249
[01/02/2024-22:52:54] [V] [TRT] Fastest Tactic: 0x0000000000000000 Time: 0.00474249
[01/02/2024-22:52:54] [V] [TRT] *************** Autotuning Reformat: Float(98,49:32,7,1) -> Float(3136,1,448,64) ***************
[01/02/2024-22:52:54] [V] [TRT] --------------- Timing Runner: Optimizer Reformat(A-V-5-MaxPool -> <out>) (Reformat)
[01/02/2024-22:52:54] [V] [TRT] Tactic: 0x00000000000003e8 Time: 0.00474249
[01/02/2024-22:52:54] [V] [TRT] Tactic: 0x00000000000003ea Time: 0.0137775
[01/02/2024-22:52:55] [V] [TRT] Tactic: 0x0000000000000000 Time: 0.00473305
[01/02/2024-22:52:55] [V] [TRT] Fastest Tactic: 0x0000000000000000 Time: 0.00473305
[01/02/2024-22:52:55] [V] [TRT] *************** Autotuning Reformat: Float(98,49:32,7,1) -> Float(784,1:4,112,16) ***************
[01/02/2024-22:52:55] [V] [TRT] --------------- Timing Runner: Optimizer Reformat(A-V-5-MaxPool -> <out>) (Reformat)
[01/02/2024-22:52:55] [V] [TRT] Tactic: 0x00000000000003e8 Time: 0.00515657
[01/02/2024-22:52:55] [V] [TRT] Tactic: 0x00000000000003ea Time: 0.0138174
[01/02/2024-22:52:55] [V] [TRT] Tactic: 0x0000000000000000 Time: 0.00515135
[01/02/2024-22:52:55] [V] [TRT] Fastest Tactic: 0x0000000000000000 Time: 0.00515135
[01/02/2024-22:52:55] [V] [TRT] *************** Autotuning Reformat: Float(98,49:32,7,1) -> Half(3136,49,7,1) ***************
[01/02/2024-22:52:55] [V] [TRT] --------------- Timing Runner: Optimizer Reformat(A-V-5-MaxPool -> <out>) (Reformat)
[01/02/2024-22:52:55] [V] [TRT] Tactic: 0x00000000000003e8 Time: 0.00473777
[01/02/2024-22:52:55] [V] [TRT] Tactic: 0x00000000000003ea Time: 0.00631573
[01/02/2024-22:52:55] [V] [TRT] Tactic: 0x0000000000000000 Time: 0.00480305
[01/02/2024-22:52:55] [V] [TRT] Fastest Tactic: 0x00000000000003e8 Time: 0.00473777
[01/02/2024-22:52:55] [V] [TRT] *************** Autotuning Reformat: Float(98,49:32,7,1) -> Half(1568,49:2,7,1) ***************
[01/02/2024-22:52:55] [V] [TRT] --------------- Timing Runner: Optimizer Reformat(A-V-5-MaxPool -> <out>) (Reformat)
[01/02/2024-22:52:55] [V] [TRT] Tactic: 0x00000000000003e8 Time: 0.00530421
[01/02/2024-22:52:55] [V] [TRT] Tactic: 0x00000000000003ea Time: 0.00707744
[01/02/2024-22:52:55] [V] [TRT] Tactic: 0x0000000000000000 Time: 0.00537464
[01/02/2024-22:52:55] [V] [TRT] Fastest Tactic: 0x00000000000003e8 Time: 0.00530421
[01/02/2024-22:52:55] [V] [TRT] *************** Autotuning Reformat: Half(3136,49,7,1) -> Float(3136,49,7,1) ***************
[01/02/2024-22:52:55] [V] [TRT] --------------- Timing Runner: Optimizer Reformat(A-V-5-MaxPool -> <out>) (Reformat)
[01/02/2024-22:52:55] [V] [TRT] Tactic: 0x00000000000003e8 Time: 0.0019452
[01/02/2024-22:52:55] [V] [TRT] Tactic: 0x00000000000003ea Time: 0.060416
[01/02/2024-22:52:55] [V] [TRT] Tactic: 0x0000000000000000 Time: 0.00379188
[01/02/2024-22:52:55] [V] [TRT] Fastest Tactic: 0x00000000000003e8 Time: 0.0019452
[01/02/2024-22:52:55] [V] [TRT] *************** Autotuning Reformat: Half(3136,49,7,1) -> Float(3136,1,448,64) ***************
[01/02/2024-22:52:55] [V] [TRT] --------------- Timing Runner: Optimizer Reformat(A-V-5-MaxPool -> <out>) (Reformat)
[01/02/2024-22:52:55] [V] [TRT] Tactic: 0x00000000000003e8 Time: 0.00470002
[01/02/2024-22:52:55] [V] [TRT] Tactic: 0x00000000000003ea Time: 0.00658951
[01/02/2024-22:52:55] [V] [TRT] Tactic: 0x0000000000000000 Time: 0.00469515
[01/02/2024-22:52:55] [V] [TRT] Fastest Tactic: 0x0000000000000000 Time: 0.00469515
[01/02/2024-22:52:55] [V] [TRT] *************** Autotuning Reformat: Half(3136,49,7,1) -> Float(784,1:4,112,16) ***************
[01/02/2024-22:52:55] [V] [TRT] --------------- Timing Runner: Optimizer Reformat(A-V-5-MaxPool -> <out>) (Reformat)
[01/02/2024-22:52:55] [V] [TRT] Tactic: 0x00000000000003e8 Time: 0.00500398
[01/02/2024-22:52:55] [V] [TRT] Tactic: 0x00000000000003ea Time: 0.00657621
[01/02/2024-22:52:55] [V] [TRT] Tactic: 0x0000000000000000 Time: 0.00499894
[01/02/2024-22:52:55] [V] [TRT] Fastest Tactic: 0x0000000000000000 Time: 0.00499894
[01/02/2024-22:52:55] [V] [TRT] *************** Autotuning Reformat: Half(3136,49,7,1) -> Float(98,49:32,7,1) ***************
[01/02/2024-22:52:55] [V] [TRT] --------------- Timing Runner: Optimizer Reformat(A-V-5-MaxPool -> <out>) (Reformat)
[01/02/2024-22:52:55] [V] [TRT] Tactic: 0x00000000000003e8 Time: 0.00751177
[01/02/2024-22:52:55] [V] [TRT] Tactic: 0x00000000000003ea Time: 0.00660281
[01/02/2024-22:52:55] [V] [TRT] Tactic: 0x0000000000000000 Time: 0.00751177
[01/02/2024-22:52:55] [V] [TRT] Fastest Tactic: 0x00000000000003ea Time: 0.00660281
[01/02/2024-22:52:55] [V] [TRT] *************** Autotuning Reformat: Half(3136,49,7,1) -> Half(1568,49:2,7,1) ***************
[01/02/2024-22:52:55] [V] [TRT] --------------- Timing Runner: Optimizer Reformat(A-V-5-MaxPool -> <out>) (Reformat)
[01/02/2024-22:52:55] [V] [TRT] Tactic: 0x00000000000003e8 Time: 0.00439744
[01/02/2024-22:52:55] [V] [TRT] Tactic: 0x00000000000003ea Time: 0.00862225
[01/02/2024-22:52:55] [V] [TRT] Tactic: 0x0000000000000000 Time: 0.00298667
[01/02/2024-22:52:55] [V] [TRT] Fastest Tactic: 0x0000000000000000 Time: 0.00298667
[01/02/2024-22:52:55] [V] [TRT] *************** Autotuning Reformat: Half(1568,49:2,7,1) -> Float(3136,49,7,1) ***************
[01/02/2024-22:52:55] [V] [TRT] --------------- Timing Runner: Optimizer Reformat(A-V-5-MaxPool -> <out>) (Reformat)
[01/02/2024-22:52:55] [V] [TRT] Tactic: 0x00000000000003e8 Time: 0.00463867
[01/02/2024-22:52:55] [V] [TRT] Tactic: 0x00000000000003ea Time: 0.00826514
[01/02/2024-22:52:55] [V] [TRT] Tactic: 0x0000000000000000 Time: 0.00290816
[01/02/2024-22:52:55] [V] [TRT] Fastest Tactic: 0x0000000000000000 Time: 0.00290816
[01/02/2024-22:52:55] [V] [TRT] *************** Autotuning Reformat: Half(1568,49:2,7,1) -> Float(3136,1,448,64) ***************
[01/02/2024-22:52:55] [V] [TRT] --------------- Timing Runner: Optimizer Reformat(A-V-5-MaxPool -> <out>) (Reformat)
[01/02/2024-22:52:55] [V] [TRT] Tactic: 0x00000000000003e8 Time: 0.00480792
[01/02/2024-22:52:55] [V] [TRT] Tactic: 0x00000000000003ea Time: 0.00579877
[01/02/2024-22:52:55] [V] [TRT] Tactic: 0x0000000000000000 Time: 0.00484206
[01/02/2024-22:52:55] [V] [TRT] Fastest Tactic: 0x00000000000003e8 Time: 0.00480792
[01/02/2024-22:52:55] [V] [TRT] *************** Autotuning Reformat: Half(1568,49:2,7,1) -> Float(784,1:4,112,16) ***************
[01/02/2024-22:52:55] [V] [TRT] --------------- Timing Runner: Optimizer Reformat(A-V-5-MaxPool -> <out>) (Reformat)
[01/02/2024-22:52:55] [V] [TRT] Tactic: 0x00000000000003e8 Time: 0.00523494
[01/02/2024-22:52:55] [V] [TRT] Tactic: 0x00000000000003ea Time: 0.00576951
[01/02/2024-22:52:55] [V] [TRT] Tactic: 0x0000000000000000 Time: 0.00524539
[01/02/2024-22:52:55] [V] [TRT] Fastest Tactic: 0x00000000000003e8 Time: 0.00523494
[01/02/2024-22:52:55] [V] [TRT] *************** Autotuning Reformat: Half(1568,49:2,7,1) -> Float(98,49:32,7,1) ***************
[01/02/2024-22:52:55] [V] [TRT] --------------- Timing Runner: Optimizer Reformat(A-V-5-MaxPool -> <out>) (Reformat)
[01/02/2024-22:52:55] [V] [TRT] Tactic: 0x00000000000003e8 Time: 0.00771465
[01/02/2024-22:52:55] [V] [TRT] Tactic: 0x00000000000003ea Time: 0.00578706
[01/02/2024-22:52:55] [V] [TRT] Tactic: 0x0000000000000000 Time: 0.00770695
[01/02/2024-22:52:55] [V] [TRT] Fastest Tactic: 0x00000000000003ea Time: 0.00578706
[01/02/2024-22:52:55] [V] [TRT] *************** Autotuning Reformat: Half(1568,49:2,7,1) -> Half(3136,49,7,1) ***************
[01/02/2024-22:52:55] [V] [TRT] --------------- Timing Runner: Optimizer Reformat(A-V-5-MaxPool -> <out>) (Reformat)
[01/02/2024-22:52:55] [V] [TRT] Tactic: 0x00000000000003e8 Time: 0.00437971
[01/02/2024-22:52:55] [V] [TRT] Tactic: 0x00000000000003ea Time: 0.00984015
[01/02/2024-22:52:55] [V] [TRT] Tactic: 0x0000000000000000 Time: 0.00286437
[01/02/2024-22:52:55] [V] [TRT] Fastest Tactic: 0x0000000000000000 Time: 0.00286437
[01/02/2024-22:52:55] [V] [TRT] =============== Computing reformatting costs: 
[01/02/2024-22:52:55] [V] [TRT] *************** Autotuning Reformat: Float(3136,1,1,1) -> Float(3136,1,3136,3136) ***************
[01/02/2024-22:52:55] [V] [TRT] --------------- Timing Runner: Optimizer Reformat(reshape_before_A-N-8-MatMul_out_tensor -> <out>) (Reformat)
[01/02/2024-22:52:55] [V] [TRT] Tactic: 0x00000000000003e8 Time: 0.00437084
[01/02/2024-22:52:55] [V] [TRT] Tactic: 0x00000000000003ea Time: 0.00448
[01/02/2024-22:52:55] [V] [TRT] Tactic: 0x0000000000000000 Time: 0.00433981
[01/02/2024-22:52:55] [V] [TRT] Fastest Tactic: 0x0000000000000000 Time: 0.00433981
[01/02/2024-22:52:55] [V] [TRT] *************** Autotuning Reformat: Float(3136,1,1,1) -> Float(784,1:4,784,784) ***************
[01/02/2024-22:52:55] [V] [TRT] --------------- Timing Runner: Optimizer Reformat(reshape_before_A-N-8-MatMul_out_tensor -> <out>) (Reformat)
[01/02/2024-22:52:55] [V] [TRT] Tactic: 0x00000000000003e8 Time: 0.00478354
[01/02/2024-22:52:55] [V] [TRT] Tactic: 0x00000000000003ea Time: 0.0305445
[01/02/2024-22:52:55] [V] [TRT] Tactic: 0x0000000000000000 Time: 0.00476892
[01/02/2024-22:52:55] [V] [TRT] Fastest Tactic: 0x0000000000000000 Time: 0.00476892
[01/02/2024-22:52:55] [V] [TRT] *************** Autotuning Reformat: Float(3136,1,1,1) -> Half(3136,1,1,1) ***************
[01/02/2024-22:52:55] [V] [TRT] --------------- Timing Runner: Optimizer Reformat(reshape_before_A-N-8-MatMul_out_tensor -> <out>) (Reformat)
[01/02/2024-22:52:55] [V] [TRT] Tactic: 0x00000000000003e8 Time: 0.0019798
[01/02/2024-22:52:55] [V] [TRT] Tactic: 0x00000000000003ea Time: 0.00491033
[01/02/2024-22:52:55] [V] [TRT] Tactic: 0x0000000000000000 Time: 0.00445506
[01/02/2024-22:52:55] [V] [TRT] Fastest Tactic: 0x00000000000003e8 Time: 0.0019798
[01/02/2024-22:52:55] [V] [TRT] *************** Autotuning Reformat: Float(3136,1,1,1) -> Half(1568,1:2,1,1) ***************
[01/02/2024-22:52:55] [V] [TRT] --------------- Timing Runner: Optimizer Reformat(reshape_before_A-N-8-MatMul_out_tensor -> <out>) (Reformat)
[01/02/2024-22:52:55] [V] [TRT] Tactic: 0x00000000000003e8 Time: 0.00464339
[01/02/2024-22:52:55] [V] [TRT] Tactic: 0x00000000000003ea Time: 0.0456046
[01/02/2024-22:52:55] [V] [TRT] Tactic: 0x0000000000000000 Time: 0.003008
[01/02/2024-22:52:55] [V] [TRT] Fastest Tactic: 0x0000000000000000 Time: 0.003008
[01/02/2024-22:52:55] [V] [TRT] *************** Autotuning Reformat: Float(3136,1,3136,3136) -> Float(3136,1,1,1) ***************
[01/02/2024-22:52:55] [V] [TRT] --------------- Timing Runner: Optimizer Reformat(reshape_before_A-N-8-MatMul_out_tensor -> <out>) (Reformat)
[01/02/2024-22:52:55] [V] [TRT] Tactic: 0x00000000000003e8 Time: 0.00417123
[01/02/2024-22:52:55] [V] [TRT] Tactic: 0x00000000000003ea Time: 0.006016
[01/02/2024-22:52:55] [V] [TRT] Tactic: 0x0000000000000000 Time: 0.00418377
[01/02/2024-22:52:55] [V] [TRT] Fastest Tactic: 0x00000000000003e8 Time: 0.00417123
[01/02/2024-22:52:55] [V] [TRT] *************** Autotuning Reformat: Float(3136,1,3136,3136) -> Float(784,1:4,784,784) ***************
[01/02/2024-22:52:55] [V] [TRT] --------------- Timing Runner: Optimizer Reformat(reshape_before_A-N-8-MatMul_out_tensor -> <out>) (Reformat)
[01/02/2024-22:52:55] [V] [TRT] Tactic: 0x00000000000003e8 Time: 0.00481752
[01/02/2024-22:52:55] [V] [TRT] Tactic: 0x00000000000003ea Time: 0.0301641
[01/02/2024-22:52:55] [V] [TRT] Tactic: 0x0000000000000000 Time: 0.00482743
[01/02/2024-22:52:55] [V] [TRT] Fastest Tactic: 0x00000000000003e8 Time: 0.00481752
[01/02/2024-22:52:55] [V] [TRT] *************** Autotuning Reformat: Float(3136,1,3136,3136) -> Half(3136,1,1,1) ***************
[01/02/2024-22:52:55] [V] [TRT] --------------- Timing Runner: Optimizer Reformat(reshape_before_A-N-8-MatMul_out_tensor -> <out>) (Reformat)
[01/02/2024-22:52:55] [V] [TRT] Tactic: 0x00000000000003e8 Time: 0.00416287
[01/02/2024-22:52:55] [V] [TRT] Tactic: 0x00000000000003ea Time: 0.00464811
[01/02/2024-22:52:55] [V] [TRT] Tactic: 0x0000000000000000 Time: 0.00415033
[01/02/2024-22:52:55] [V] [TRT] Fastest Tactic: 0x0000000000000000 Time: 0.00415033
[01/02/2024-22:52:55] [V] [TRT] *************** Autotuning Reformat: Float(3136,1,3136,3136) -> Half(1568,1:2,1,1) ***************
[01/02/2024-22:52:55] [V] [TRT] --------------- Timing Runner: Optimizer Reformat(reshape_before_A-N-8-MatMul_out_tensor -> <out>) (Reformat)
[01/02/2024-22:52:55] [V] [TRT] Tactic: 0x00000000000003e8 Time: 0.00465755
[01/02/2024-22:52:55] [V] [TRT] Tactic: 0x00000000000003ea Time: 0.0458617
[01/02/2024-22:52:55] [V] [TRT] Tactic: 0x0000000000000000 Time: 0.00465283
[01/02/2024-22:52:55] [V] [TRT] Fastest Tactic: 0x0000000000000000 Time: 0.00465283
[01/02/2024-22:52:55] [V] [TRT] *************** Autotuning Reformat: Float(784,1:4,784,784) -> Float(3136,1,1,1) ***************
[01/02/2024-22:52:55] [V] [TRT] --------------- Timing Runner: Optimizer Reformat(reshape_before_A-N-8-MatMul_out_tensor -> <out>) (Reformat)
[01/02/2024-22:52:55] [V] [TRT] Tactic: 0x00000000000003e8 Time: 0.00459429
[01/02/2024-22:52:55] [V] [TRT] Tactic: 0x00000000000003ea Time: 0.116517
[01/02/2024-22:52:55] [V] [TRT] Tactic: 0x0000000000000000 Time: 0.00457143
[01/02/2024-22:52:55] [V] [TRT] Fastest Tactic: 0x0000000000000000 Time: 0.00457143
[01/02/2024-22:52:55] [V] [TRT] *************** Autotuning Reformat: Float(784,1:4,784,784) -> Float(3136,1,3136,3136) ***************
[01/02/2024-22:52:55] [V] [TRT] --------------- Timing Runner: Optimizer Reformat(reshape_before_A-N-8-MatMul_out_tensor -> <out>) (Reformat)
[01/02/2024-22:52:55] [V] [TRT] Tactic: 0x00000000000003e8 Time: 0.00475193
[01/02/2024-22:52:55] [V] [TRT] Tactic: 0x00000000000003ea Time: 0.0300773
[01/02/2024-22:52:55] [V] [TRT] Tactic: 0x0000000000000000 Time: 0.00473305
[01/02/2024-22:52:55] [V] [TRT] Fastest Tactic: 0x0000000000000000 Time: 0.00473305
[01/02/2024-22:52:55] [V] [TRT] *************** Autotuning Reformat: Float(784,1:4,784,784) -> Half(3136,1,1,1) ***************
[01/02/2024-22:52:55] [V] [TRT] --------------- Timing Runner: Optimizer Reformat(reshape_before_A-N-8-MatMul_out_tensor -> <out>) (Reformat)
[01/02/2024-22:52:55] [V] [TRT] Tactic: 0x00000000000003e8 Time: 0.00473305
[01/02/2024-22:52:55] [V] [TRT] Tactic: 0x00000000000003ea Time: 0.045824
[01/02/2024-22:52:55] [V] [TRT] Tactic: 0x0000000000000000 Time: 0.00467171
[01/02/2024-22:52:55] [V] [TRT] Fastest Tactic: 0x0000000000000000 Time: 0.00467171
[01/02/2024-22:52:55] [V] [TRT] *************** Autotuning Reformat: Float(784,1:4,784,784) -> Half(1568,1:2,1,1) ***************
[01/02/2024-22:52:55] [V] [TRT] --------------- Timing Runner: Optimizer Reformat(reshape_before_A-N-8-MatMul_out_tensor -> <out>) (Reformat)
[01/02/2024-22:52:55] [V] [TRT] Tactic: 0x00000000000003e8 Time: 0.00511477
[01/02/2024-22:52:55] [V] [TRT] Tactic: 0x00000000000003ea Time: 0.045824
[01/02/2024-22:52:55] [V] [TRT] Tactic: 0x0000000000000000 Time: 0.00509982
[01/02/2024-22:52:55] [V] [TRT] Fastest Tactic: 0x0000000000000000 Time: 0.00509982
[01/02/2024-22:52:55] [V] [TRT] *************** Autotuning Reformat: Float(98,1:32,1,1) -> Float(3136,1,1,1) ***************
[01/02/2024-22:52:55] [V] [TRT] --------------- Timing Runner: Optimizer Reformat(reshape_before_A-N-8-MatMul_out_tensor -> <out>) (Reformat)
[01/02/2024-22:52:55] [V] [TRT] Tactic: 0x00000000000003e8 Time: 0.00456229
[01/02/2024-22:52:55] [V] [TRT] Tactic: 0x00000000000003ea Time: 0.116443
[01/02/2024-22:52:55] [V] [TRT] Tactic: 0x0000000000000000 Time: 0.00458514
[01/02/2024-22:52:55] [V] [TRT] Fastest Tactic: 0x00000000000003e8 Time: 0.00456229
[01/02/2024-22:52:55] [V] [TRT] *************** Autotuning Reformat: Float(98,1:32,1,1) -> Float(3136,1,3136,3136) ***************
[01/02/2024-22:52:55] [V] [TRT] --------------- Timing Runner: Optimizer Reformat(reshape_before_A-N-8-MatMul_out_tensor -> <out>) (Reformat)
[01/02/2024-22:52:55] [V] [TRT] Tactic: 0x00000000000003e8 Time: 0.00476404
[01/02/2024-22:52:55] [V] [TRT] Tactic: 0x00000000000003ea Time: 0.0301641
[01/02/2024-22:52:55] [V] [TRT] Tactic: 0x0000000000000000 Time: 0.00471889
[01/02/2024-22:52:55] [V] [TRT] Fastest Tactic: 0x0000000000000000 Time: 0.00471889
[01/02/2024-22:52:55] [V] [TRT] *************** Autotuning Reformat: Float(98,1:32,1,1) -> Float(784,1:4,784,784) ***************
[01/02/2024-22:52:55] [V] [TRT] --------------- Timing Runner: Optimizer Reformat(reshape_before_A-N-8-MatMul_out_tensor -> <out>) (Reformat)
[01/02/2024-22:52:55] [V] [TRT] Tactic: 0x00000000000003e8 Time: 0.00527151
[01/02/2024-22:52:55] [V] [TRT] Tactic: 0x00000000000003ea Time: 0.0301641
[01/02/2024-22:52:55] [V] [TRT] Tactic: 0x0000000000000000 Time: 0.00522971
[01/02/2024-22:52:55] [V] [TRT] Fastest Tactic: 0x0000000000000000 Time: 0.00522971
[01/02/2024-22:52:55] [V] [TRT] *************** Autotuning Reformat: Float(98,1:32,1,1) -> Half(3136,1,1,1) ***************
[01/02/2024-22:52:55] [V] [TRT] --------------- Timing Runner: Optimizer Reformat(reshape_before_A-N-8-MatMul_out_tensor -> <out>) (Reformat)
[01/02/2024-22:52:55] [V] [TRT] Tactic: 0x00000000000003e8 Time: 0.00464811
[01/02/2024-22:52:55] [V] [TRT] Tactic: 0x00000000000003ea Time: 0.0458971
[01/02/2024-22:52:55] [V] [TRT] Tactic: 0x0000000000000000 Time: 0.00464339
[01/02/2024-22:52:55] [V] [TRT] Fastest Tactic: 0x0000000000000000 Time: 0.00464339
[01/02/2024-22:52:55] [V] [TRT] *************** Autotuning Reformat: Float(98,1:32,1,1) -> Half(1568,1:2,1,1) ***************
[01/02/2024-22:52:55] [V] [TRT] --------------- Timing Runner: Optimizer Reformat(reshape_before_A-N-8-MatMul_out_tensor -> <out>) (Reformat)
[01/02/2024-22:52:55] [V] [TRT] Tactic: 0x00000000000003e8 Time: 0.00510955
[01/02/2024-22:52:55] [V] [TRT] Tactic: 0x00000000000003ea Time: 0.0459703
[01/02/2024-22:52:55] [V] [TRT] Tactic: 0x0000000000000000 Time: 0.00510955
[01/02/2024-22:52:55] [V] [TRT] Fastest Tactic: 0x00000000000003e8 Time: 0.00510955
[01/02/2024-22:52:55] [V] [TRT] *************** Autotuning Reformat: Half(3136,1,1,1) -> Float(3136,1,1,1) ***************
[01/02/2024-22:52:55] [V] [TRT] --------------- Timing Runner: Optimizer Reformat(reshape_before_A-N-8-MatMul_out_tensor -> <out>) (Reformat)
[01/02/2024-22:52:55] [V] [TRT] Tactic: 0x00000000000003e8 Time: 0.00192707
[01/02/2024-22:52:55] [V] [TRT] Tactic: 0x00000000000003ea Time: 0.00605257
[01/02/2024-22:52:55] [V] [TRT] Tactic: 0x0000000000000000 Time: 0.00371716
[01/02/2024-22:52:55] [V] [TRT] Fastest Tactic: 0x00000000000003e8 Time: 0.00192707
[01/02/2024-22:52:55] [V] [TRT] *************** Autotuning Reformat: Half(3136,1,1,1) -> Float(3136,1,3136,3136) ***************
[01/02/2024-22:52:55] [V] [TRT] --------------- Timing Runner: Optimizer Reformat(reshape_before_A-N-8-MatMul_out_tensor -> <out>) (Reformat)
[01/02/2024-22:52:55] [V] [TRT] Tactic: 0x00000000000003e8 Time: 0.00437527
[01/02/2024-22:52:55] [V] [TRT] Tactic: 0x00000000000003ea Time: 0.00467171
[01/02/2024-22:52:55] [V] [TRT] Tactic: 0x0000000000000000 Time: 0.00433538
[01/02/2024-22:52:55] [V] [TRT] Fastest Tactic: 0x0000000000000000 Time: 0.00433538
[01/02/2024-22:52:55] [V] [TRT] *************** Autotuning Reformat: Half(3136,1,1,1) -> Float(784,1:4,784,784) ***************
[01/02/2024-22:52:55] [V] [TRT] --------------- Timing Runner: Optimizer Reformat(reshape_before_A-N-8-MatMul_out_tensor -> <out>) (Reformat)
[01/02/2024-22:52:55] [V] [TRT] Tactic: 0x00000000000003e8 Time: 0.00476389
[01/02/2024-22:52:55] [V] [TRT] Tactic: 0x00000000000003ea Time: 0.0138705
[01/02/2024-22:52:55] [V] [TRT] Tactic: 0x0000000000000000 Time: 0.00476389
[01/02/2024-22:52:55] [V] [TRT] Fastest Tactic: 0x00000000000003e8 Time: 0.00476389
[01/02/2024-22:52:55] [V] [TRT] *************** Autotuning Reformat: Half(3136,1,1,1) -> Half(1568,1:2,1,1) ***************
[01/02/2024-22:52:55] [V] [TRT] --------------- Timing Runner: Optimizer Reformat(reshape_before_A-N-8-MatMul_out_tensor -> <out>) (Reformat)
[01/02/2024-22:52:55] [V] [TRT] Tactic: 0x00000000000003e8 Time: 0.00437971
[01/02/2024-22:52:55] [V] [TRT] Tactic: 0x00000000000003ea Time: 0.0469577
[01/02/2024-22:52:55] [V] [TRT] Tactic: 0x0000000000000000 Time: 0.00291676
[01/02/2024-22:52:55] [V] [TRT] Fastest Tactic: 0x0000000000000000 Time: 0.00291676
[01/02/2024-22:52:55] [V] [TRT] *************** Autotuning Reformat: Half(1568,1:2,1,1) -> Float(3136,1,1,1) ***************
[01/02/2024-22:52:55] [V] [TRT] --------------- Timing Runner: Optimizer Reformat(reshape_before_A-N-8-MatMul_out_tensor -> <out>) (Reformat)
[01/02/2024-22:52:55] [V] [TRT] Tactic: 0x00000000000003e8 Time: 0.00461036
[01/02/2024-22:52:55] [V] [TRT] Tactic: 0x00000000000003ea Time: 0.0469943
[01/02/2024-22:52:55] [V] [TRT] Tactic: 0x0000000000000000 Time: 0.00293159
[01/02/2024-22:52:55] [V] [TRT] Fastest Tactic: 0x0000000000000000 Time: 0.00293159
[01/02/2024-22:52:55] [V] [TRT] *************** Autotuning Reformat: Half(1568,1:2,1,1) -> Float(3136,1,3136,3136) ***************
[01/02/2024-22:52:55] [V] [TRT] --------------- Timing Runner: Optimizer Reformat(reshape_before_A-N-8-MatMul_out_tensor -> <out>) (Reformat)
[01/02/2024-22:52:55] [V] [TRT] Tactic: 0x00000000000003e8 Time: 0.00481768
[01/02/2024-22:52:55] [V] [TRT] Tactic: 0x00000000000003ea Time: 0.0138439
[01/02/2024-22:52:55] [V] [TRT] Tactic: 0x0000000000000000 Time: 0.00488594
[01/02/2024-22:52:55] [V] [TRT] Fastest Tactic: 0x00000000000003e8 Time: 0.00481768
[01/02/2024-22:52:55] [V] [TRT] *************** Autotuning Reformat: Half(1568,1:2,1,1) -> Float(784,1:4,784,784) ***************
[01/02/2024-22:52:55] [V] [TRT] --------------- Timing Runner: Optimizer Reformat(reshape_before_A-N-8-MatMul_out_tensor -> <out>) (Reformat)
[01/02/2024-22:52:55] [V] [TRT] Tactic: 0x00000000000003e8 Time: 0.00525584
[01/02/2024-22:52:55] [V] [TRT] Tactic: 0x00000000000003ea Time: 0.0138174
[01/02/2024-22:52:55] [V] [TRT] Tactic: 0x0000000000000000 Time: 0.00528718
[01/02/2024-22:52:55] [V] [TRT] Fastest Tactic: 0x00000000000003e8 Time: 0.00525584
[01/02/2024-22:52:55] [V] [TRT] *************** Autotuning Reformat: Half(1568,1:2,1,1) -> Half(3136,1,1,1) ***************
[01/02/2024-22:52:55] [V] [TRT] --------------- Timing Runner: Optimizer Reformat(reshape_before_A-N-8-MatMul_out_tensor -> <out>) (Reformat)
[01/02/2024-22:52:55] [V] [TRT] Tactic: 0x00000000000003e8 Time: 0.00441074
[01/02/2024-22:52:55] [V] [TRT] Tactic: 0x00000000000003ea Time: 0.0464823
[01/02/2024-22:52:55] [V] [TRT] Tactic: 0x0000000000000000 Time: 0.0028454
[01/02/2024-22:52:55] [V] [TRT] Fastest Tactic: 0x0000000000000000 Time: 0.0028454
[01/02/2024-22:52:55] [V] [TRT] =============== Computing reformatting costs: 
[01/02/2024-22:52:55] [V] [TRT] *************** Autotuning Reformat: Float(1024,1,1,1) -> Float(1024,1,1024,1024) ***************
[01/02/2024-22:52:55] [V] [TRT] --------------- Timing Runner: Optimizer Reformat(A-N-10-Relu_out_tensor -> <out>) (Reformat)
[01/02/2024-22:52:55] [V] [TRT] Tactic: 0x00000000000003e8 Time: 0.00273527
[01/02/2024-22:52:55] [V] [TRT] Tactic: 0x00000000000003ea Time: 0.00381113
[01/02/2024-22:52:55] [V] [TRT] Tactic: 0x0000000000000000 Time: 0.00273251
[01/02/2024-22:52:55] [V] [TRT] Fastest Tactic: 0x0000000000000000 Time: 0.00273251
[01/02/2024-22:52:55] [V] [TRT] *************** Autotuning Reformat: Float(1024,1,1,1) -> Float(256,1:4,256,256) ***************
[01/02/2024-22:52:55] [V] [TRT] --------------- Timing Runner: Optimizer Reformat(A-N-10-Relu_out_tensor -> <out>) (Reformat)
[01/02/2024-22:52:55] [V] [TRT] Tactic: 0x00000000000003e8 Time: 0.00308134
[01/02/2024-22:52:55] [V] [TRT] Tactic: 0x00000000000003ea Time: 0.014848
[01/02/2024-22:52:55] [V] [TRT] Tactic: 0x0000000000000000 Time: 0.00296452
[01/02/2024-22:52:55] [V] [TRT] Fastest Tactic: 0x0000000000000000 Time: 0.00296452
